{
  "contractVersion": "0.1.0",
  "minBet": "1.00",
  "maxBet": "1000.00",
  "startingBalance": "1000.00",
  "maxMultiplier": 100.0,
  "growthRate": 0.12,
  "targetRtp": 0.97,
  "bettingWindowMs": 5000,
  "settleDelayMs": 3000,
  "tickIntervalMs": 100,
  "multiplierDecimals": 2,
  "autoCashOutMin": 1.01,
  "defaultLanguage": "en",
  "supportedLanguages": [
    "en",
    "fr"
  ],
  "quickBetChips": [
    "10.00",
    "50.00",
    "100.00",
    "250.00"
  ],
  "realityCheckMinutes": 30
}
